{
  "schema_version": "debark.manifest/v1",
  "bundle_id": "bd-80be0631f286fe7e",
  "created_at": "2026-09-03T12:10:00Z",
  "format_version": 1,
  "tool": { "name": "debark", "version": "1.0.0", "build_digest": "353797a12e4fbdb499f56f11b2b24ab86179b605b65b259358c00aed8b53541d", "edition": "official" },
  "snapshot_digest": "94a1a6bd87442a401b30634b46577a677f31a4ad066a943fb646ff6899054df0",
  "lock_digest": "80be0631f286fe7e12719ab399568f969c31d98f4bf6321666f58cc15e21ba4f",
  "repository": {
    "packages_sha256": "4a7c25efce77741075c75312ff07c5a6033ad5d5f6b5705ba4aad8284091456a",
    "packages_gz_sha256": "48c6dc7efba94dc886451717a6d7077271646ac6be4b90e561d6ce86daf87645",
    "release_sha256": "b6fd458a7205924b78c0b1bcc6730fc69ee72e093dd49f56e106479057f9441d",
    "package_count": 2, "pool_bytes": 2045888
  },
  "files": [
    { "path": "lock.json", "size": 4096, "sha256": "80be0631f286fe7e12719ab399568f969c31d98f4bf6321666f58cc15e21ba4f" },
    { "path": "repo/Packages", "size": 12000, "sha256": "4a7c25efce77741075c75312ff07c5a6033ad5d5f6b5705ba4aad8284091456a" }
  ],
  "target": { "distro_id": "debian", "version_id": "12", "codename": "bookworm", "arch": "amd64" },
  "sbom_ref": "sbom.cdx.json",
  "evidence_ref": "evidence.json"
}
